{
  "$schema": "../../../../schemas/visual-reference-generation-plan.schema.json",
  "schema_version": "1.0.0",
  "plan_id": "blue-academic-dominant-result-ab-v1",
  "pack_id": "blue-academic",
  "status": "completed",
  "objective": "用三组受控 A/B 参考页比较真实感虚构图表与中性模拟图表对视觉完成度和可编辑迁移性的影响。",
  "output_spec": {
    "aspect_ratio": "16:9",
    "target_width_px": 1600,
    "target_height_px": 900,
    "format": "png",
    "language": "zh-CN"
  },
  "shared_prompt": "生成一张 16:9 横向中文学术汇报 PPT 视觉参考图。纯白背景，以蓝色为主要学术基调，整体稳定、清晰、现代，适合论文汇报、组会或答辩。页面中的中文使用现代清晰、接近微软雅黑气质的无衬线字体；标题加粗，正文常规字重。请充分发挥你的版式与审美判断，不要照搬常见模板。页面应像真实可用于汇报的幻灯片，不是海报。主图是视觉中心，解释文字明显从属，但不规定精确比例。卡片、边框和阴影仅在确实有助于信息组织时使用。页面中所有可见文字必须为准确的简体中文，避免英文、乱码、伪汉字和无意义文字。不设置固定页脚、页码或来源区。这张图片只用于后续重建为可编辑 PPT 的视觉参考，不要求使用基础形状限制设计。",
  "visible_copy": {
    "eyebrow": "关键结果",
    "title": "多源约束提高了复杂条件下的结果稳定性",
    "interpretation": [
      "不同条件下趋势保持一致",
      "关键指标的波动明显收敛",
      "结果具有较好的可重复性"
    ],
    "caption": "不同实验条件下的结果对比"
  },
  "evaluation": {
    "dimensions": [
      "visual_quality",
      "editable_transferability"
    ],
    "admission": [
      "第一眼愿意用于真实学术汇报",
      "信息层级清楚且主证据突出",
      "可以合理重建为可编辑 PPT",
      "中文无明显错字、乱码或伪汉字",
      "没有廉价商务模板感"
    ]
  },
  "tasks": [
    {
      "id": "dominant-result-01-a",
      "pair_id": "dominant-result-01",
      "variant": "A-realistic-synthetic",
      "source_task_id": null,
      "composition": "大型主图配窄右侧解释区",
      "task_prompt": "采用“大型主图 + 窄右侧解释区”的构图。主图使用一张完成度接近真实论文图表的多条件折线对比图，包含完整坐标轴刻度、三组曲线、图例和少量关键标记。坐标使用“实验条件”“稳定性指标”等通用中文，不虚构具体学科、单位、样本量或统计显著性。右侧放置三条简短解释，保持从属。",
      "status": "reviewed",
      "output_file": "candidates/dominant-result-01-a.png"
    },
    {
      "id": "dominant-result-01-b",
      "pair_id": "dominant-result-01",
      "variant": "B-neutral-simulated",
      "source_task_id": "dominant-result-01-a",
      "composition": "沿用 A 版的大型主图配窄右侧解释区",
      "task_prompt": "以上一张 A 版图片为参考，只替换主图内容，尽量保持页面构图、字体层级、留白和整体视觉语言不变。把真实感折线图改为高完成度的中性模拟折线图：保留坐标轴、曲线、图例和标记的图表结构，但使用“组别一”“组别二”“组别三”“指标 A”“条件 B”等中性中文，不表达具体科学意义。不要改成空白灰框、线框图或低完成度占位符。其他可见文字保持不变且准确。",
      "status": "reviewed",
      "output_file": "candidates/dominant-result-01-b.png"
    },
    {
      "id": "dominant-result-02-a",
      "pair_id": "dominant-result-02",
      "variant": "A-realistic-synthetic",
      "source_task_id": null,
      "composition": "大型主图配底部轻量结论区",
      "task_prompt": "采用“大型主图 + 底部轻量结论区”的构图。主图使用一张完成度接近真实论文图表的多条件折线对比图，包含完整坐标轴刻度、三组曲线、图例和少量关键标记。坐标使用“实验条件”“稳定性指标”等通用中文，不虚构具体学科、单位、样本量或统计显著性。底部结论区应轻量、克制，不使用厚重通栏色带。",
      "status": "reviewed",
      "output_file": "candidates/dominant-result-02-a.png"
    },
    {
      "id": "dominant-result-02-b",
      "pair_id": "dominant-result-02",
      "variant": "B-neutral-simulated",
      "source_task_id": "dominant-result-02-a",
      "composition": "沿用 A 版的大型主图配底部轻量结论区",
      "task_prompt": "以上一张 A 版图片为参考，只替换主图内容，尽量保持页面构图、字体层级、留白和整体视觉语言不变。把真实感折线图改为高完成度的中性模拟折线图：保留坐标轴、曲线、图例和标记的图表结构，但使用“组别一”“组别二”“组别三”“指标 A”“条件 B”等中性中文，不表达具体科学意义。不要改成空白灰框、线框图或低完成度占位符。其他可见文字保持不变且准确。",
      "status": "reviewed",
      "output_file": "candidates/dominant-result-02-b.png"
    },
    {
      "id": "dominant-result-03-a",
      "pair_id": "dominant-result-03",
      "variant": "A-realistic-synthetic",
      "source_task_id": null,
      "composition": "居中主图配两侧少量注释",
      "task_prompt": "采用“居中大型主图 + 两侧少量注释”的构图。主图使用一张完成度接近真实论文图表的多条件折线对比图，包含完整坐标轴刻度、三组曲线、图例和少量关键标记。坐标使用“实验条件”“稳定性指标”等通用中文，不虚构具体学科、单位、样本量或统计显著性。两侧注释要少而清楚，通过细线或轻量标记连接关键趋势，不要压缩主图。",
      "status": "reviewed",
      "output_file": "candidates/dominant-result-03-a.png"
    },
    {
      "id": "dominant-result-03-b",
      "pair_id": "dominant-result-03",
      "variant": "B-neutral-simulated",
      "source_task_id": "dominant-result-03-a",
      "composition": "沿用 A 版的居中主图配两侧少量注释",
      "task_prompt": "以上一张 A 版图片为参考，只替换主图内容，尽量保持页面构图、字体层级、留白和整体视觉语言不变。把真实感折线图改为高完成度的中性模拟折线图：保留坐标轴、曲线、图例和标记的图表结构，但使用“组别一”“组别二”“组别三”“指标 A”“条件 B”等中性中文，不表达具体科学意义。不要改成空白灰框、线框图或低完成度占位符。其他可见文字保持不变且准确。",
      "status": "reviewed",
      "output_file": "candidates/dominant-result-03-b.png"
    }
  ],
  "result": {
    "decision": "realistic-generic",
    "summary": "结构真实、语义通用的图表比中性占位标签更自然；防止误用应依靠元数据而不是降低参考图完成度。",
    "selected_reference_ids": [
      "dominant-result-01",
      "dominant-result-02",
      "dominant-result-03"
    ],
    "notes": [
      "中性标签没有明显提高可迁移性",
      "参考图中的示例数据、曲线和结论必须禁止复制",
      "后续停止生成同类 A/B，改为按页面角色扩展"
    ]
  }
}
